<?xml version="1.0"?>
<!-- $Id: unicode.mapping.ru.xml,v 1.1 2005/12/05 08:19:40 rpopov Exp $ -->
<!DOCTYPE mapping SYSTEM "unicode.mapping.dtd">
<mapping>
  <character>
    <unicode>&#x00A0;</unicode>
    <preferred>~</preferred>
  </character>
  <character>
    <unicode>&#8212;</unicode>
    <preferred>---</preferred>
  </character>
  <character>
    <unicode>&#x00AB;</unicode>
    <preferred>\guillemotleft </preferred>
  </character>
  <character>
    <unicode>&#x00BB;</unicode>
    <preferred>\guillemotright </preferred>
  </character>
  <character>
    <unicode>&#x201E;</unicode>
    <preferred>,,</preferred>
  </character>
  <character>
    <unicode>&#x201C;</unicode>
    <preferred>\textquotedblleft\space </preferred>
  </character>
  <character>
    <unicode>&#8221;</unicode>
    <preferred>\textquotedblright\space </preferred>
  </character>
</mapping>
